Book Id,ISBN,Lexile Score,Bookshelf,Tags,Wishlist,Started Reading On,Ended Reading On,Pages Read,Read,My Rating,Review,Short note,Advanced note,Signed,Condition,Number of copies,Quotes,Flashcards,Title,Subtitle,Language,Categories,Authors,Illustrators,Translators,Editors,Narrators,Photographers,Publisher,Page Count,Published At,Format,Edition,Series,Volume,Loan Type,Loan Name,Loan Start Date,Loan Due Date,Purchase Type,Purchase From,Purchase Price,Purchase Date,Transfer Type,Transfer place,Transfer Price,Transfer Date,Description,Date added
252363,9.78055E+12,,My books,,0,,,0,0,,,,,0,,1,,,Island of the Blue Dolphins (Island of the Blue Dolphins #1),Island Of The Blue Dolphins,en,,Scott O'Dell,,,,,,Scholastic Inc.,177,9/1/2010,paperback,,Island of the Blue Dolphins,1,,,,,,,,,,,,,"In the Pacific there is an island that looks like a big fish sunning itself in the sea. Around it, blue dolphins swim, otters play, and sea elephants and sea birds abound. Once, Indians also lived on the island. And when they left and sailed to the east, one young girl was left behind. — This is the story of Karana, the Indian girl who lived alone for years on the Island of the Blue Dolphins. Year after year, she watched one season pass into another and waited for a ship to take her away. But while she waited, she kept herself alive by building shelter, making weapons, finding food, and fighting her enemies, the wild dogs. It is not only an unusual adventure of survival, but also a tale of natural beauty and personal discovery.",12/26/2025
277343,9.78062E+12,1000L,My books,,0,,,0,0,,,,,0,,1,,,The Hobbit,,en,Classics,J.R.R. Tolkien,,,,,,Houghton Mifflin Harcourt,277,9/21/2007,hardcover,,,,,,,,,,,,,,,,"This deluxe hardcover edition of J.R.R. Tolkien's classic prelude to his Lord of the Rings trilogy contains a short introduction by Christopher Tolkien, a reset text incorporating the most up-to-date corrections, and all of Tolkien’s own drawings and full-color illustrations, including the rare “Mirkwood” piece.


J.R.R. Tolkien's own description for the original edition: ""If you care for journeys there and back, out of the comfortable Western world, over the edge of the Wild, and home again, and can take an interest in a humble hero (blessed with a little wisdom and a little courage and considerable good luck), here is a record of such a journey and such a traveler. The period is the ancient time between the age of Faerie and the dominion of men, when the famous forest of Mirkwood was still standing, and the mountains were full of danger. In following the path of this humble adventurer, you will learn by the way (as he did) -- if you do not already know all about these things -- much about trolls, goblins, dwarves, and elves, and get some glimpses into the history and politics of a neglected but important period. For Mr. Bilbo Baggins visited various notable persons; conversed with the dragon, Smaug the Magnificent; and was present, rather unwillingly, at the Battle of the Five Armies. This is all the more remarkable, since he was a hobbit. Hobbits have hitherto been passed over in history and legend, perhaps because they as a rule preferred comfort to excitement. But thi...",12/26/2025
4135332,9.78006E+12,,My books,,0,7/9/2025,7/9/2025,304,1,4.5,,,,0,,1,,,Operation Do-Over,,en,"JUVENILE FICTION/Humorous Stories,JUVENILE FICTION/Social Themes / Friendship,JUVENILE FICTION/Time Travel",Gordon Korman,,,,,,Balzer + Bray,304,1/1/2022,hardcover,,,,,,,,,,,,,,,,"From theNew York Timesbestselling author ofThe Unteachables, Gordon Korman, comes a hilarious new high-concept friendship story in the vein of Back to the Future. Perfect for fans of Korman’sRestart.

Mason and Ty were once the very best of friends, like two nerdy sides of the same coin . . . until seventh grade, when Ava Petrakis came along. Now Mason can trace everything bad in his life to that terrible fight they had over the new girl. The one thing he’d give anything for is a do-over. But that can’t happen in real life—can it?

As a science kid, Mason knows do-overs are impossible, so he can’t believe it when he wakes up from a freak accident and finds himself magically transported back to seventh grade. His parents aren’t yet divorced and his beloved sheepdog is still alive. Best of all, he and Ty haven’t had their falling-out yet.

It makes no logical sense, but Mason is determined to use this second chance to not only save his friendship (and his dog!) but do other things differently—like trying out for the football team and giving new friends a chance. There’s just one person he’ll be avoiding at all costs: Ava. But despite his best efforts, will he be able to stop the chain of events that made his previous life implode?",7/9/2025
1513744,9.7804E+12,880L,My books,,0,7/2/2025,7/5/2025,227,1,3.5,,,,0,,1,,,I Am Morgan le Fay,A Tale from Camelot,en,"Fantasy & Magical,Young Adult Fiction,Fiction",Nancy Springer,,,,,,Philomel Books,227,3/19/2001,hardcover,,,,,,,,,,,,,,,,"Fans who love King Arthur's legend, Camelot, Merlin, and similar tales will love reading about Morgan le Fay.

Morgan is a willful, mischievous girl with mismatched eyes of emerald and violet. A girl of magic, whose childhood ends when King Uther Pendragon murders her father and steals away her mother. Then Pendragon dies and, in a warring country with no one to claim the throne, there are many who want Morgan dead. But Morgan has power, and magic. She is able to change the course of history, to become other, to determine her own fate-and, thus the fate of Britain. She will become Morgan le Fay. 

""Springer wields language like a sword, and both blood and flowers spring to these pages in vivid hues."" (Booklist, starred review)",7/9/2025
2400850,9.7804E+12,840L,My books,,0,6/27/2025,7/1/2025,192,1,2.5,,,,0,,1,,,I Am Mordred,A Tale from Camelot,en,"Fiction,Young Adult Fiction,Multigenerational",Nancy Springer,,,,,,Philomel Books,192,4/13/1998,hardcover,,,,,,,,,,,,,,,,"Fans of the King Arthur legend will love this tale about one of the most fascinating and misunderstood heroes of Arthurian lore. An epic fantasy comes to life for Camelot fans.

What will a person give to forsake his destiny? From his very incarnation, Mordred has been a pawn in Camelot's history. Foretold by Merlin that he will grow up to kill his father, the beloved King Arthur, young Mordred struggles with his fate, loathing the great king who tried to kill him as a baby, yet journeying to Camelot where he learns to serve and idolize the legendary leader. Torn between feelings of love and hate, Mordred yearns to make peace with Arthur, who still refuses to acknowledge him. But Mordred is determined to have peace at any price--even if it costs him his soul. 


""In language worthy of her heroic subject, Springer reworks Arthuriana to craft an original tale resonant with archetypal themes of love, loss, betrayal and reconciliation. Her strong female characters and bold recasting of traditional villains and heroes will draw the rapt attention of both sexes."" -- Publishers Weekly",7/9/2025
9095,9.78014E+12,HL570L,My books,,0,7/5/2025,7/8/2025,336,1,4.5,,,,0,,1,,,Treasure Island,,en,"Picture Books,Classics,Action & Adventure",Robert Louis Stevenson,,,,,,Puffin Books,336,3/27/2008,paperback,,,,,,,,,,,,,,,,"Following the demise of bloodthirsty buccaneer Captain Flint, young Jim Hawkins finds himself with the key to a fortune. For he has discovered a map that will lead him to the fabled Treasure Island. But a host of villains, wild beasts and deadly savages stand between him and the stash of gold. Not to mention the most infamous pirate ever to sail the high seas . . . With a wonderfully funny introduction by award-winning author Eoin Colfer, Treasure Island is one of the twenty brilliant classic stories being reissued in Puffin Classics in March 2015.",7/9/2025
5352576,9.78059E+12,640L,My books,,0,5/1/2025,5/3/2025,288,1,5,,,,0,,1,,,Jennifer Chan Is Not Alone,,en,"Middle Grade Books,Bullying,Paranormal, Occult & Supernatural",Tae Keller,,,,,,Random House Books for Young Readers,288,4/26/2022,hardcover,,,,,,,,,,,,,,,,"In her first novel since winning the Newbery Medal for When You Trap a Tiger, Tae Keller offers a gripping and emotional story about a girl who is alienated by her friends . . . for believing in aliens.

Sometimes middle school can make you feel like you're totally alone in the universe...but what if we aren't alone at all?

Thanks to her best friend, Reagan, Mallory Moss knows the rules of middle school. The most important one? You have to fit in to survive. But then Jennifer Chan moves in across the street, and that rule doesn’t seem to apply. Jennifer doesn’t care about the laws of middle school, or the laws of the universe. She believes in aliens—and she thinks she can find them.

Then Jennifer goes missing. Using clues from Jennifer’s journals, Mallory goes searching. But the closer she gets, the more Mallory has to confront why Jennifer might have run . . . and face the truth within herself.

Tae Keller lights up the sky with this insightful story about shifting friendships, right and wrong, and the power we all hold to influence and change one another. No one is alone.",5/4/2025
7763007,9.78152E+12,590L,My books,,0,4/27/2025,4/29/2025,320,1,5,,,,0,,1,,,When You Trap a Tiger,(Winner of the 2021 Newbery Medal),en,Juvenile Fiction,Tae Keller,,,,,,National Geographic Books,320,1/3/2023,paperback,,,,,,,,,,,,,,,,"WINNER OF THE NEWBERY MEDAL • NEW YORK TIMES BESTSELLER • WINNER OF THE ASIAN/PACIFIC AMERICAN AWARD FOR CHILDREN'S LITERATURE Would you make a deal with a magical tiger? This uplifting story brings Korean folklore to life as a girl goes on a quest to unlock the power of stories and save her grandmother. When Lily and her family move in with her sick grandmother, a magical tiger straight out of her halmoni's Korean folktales arrives, prompting Lily to unravel a secret family history. Long, long ago, Halmoni stole something from the tigers. Now they want it back. And when one of the tigers approaches Lily with a deal—return what her grandmother stole in exchange for Halmoni's health—Lily is tempted to agree. But deals with tigers are never what they seem! With the help of her sister and her new friend Ricky, Lily must find her voice . . . and the courage to face a tiger.",4/29/2025
62344,9.78055E+12,,My books,,0,4/10/2025,4/12/2025,340,1,5,,,,0,,1,,,"The Evolution of Calpurnia Tate (Calpurnia Tate, #1)",,en,,Jacqueline Kelly,,,,,,Scholastic Inc.,340,9/1/2010,paperback,,Calpurnia Tate,1,,,,,,,,,,,,,"Calpurnia Virginia Tate is eleven years old in 1899 when she wonders why the yellow grasshoppers in her Texas backyard are so much bigger than the green ones. With a little help from her notoriously cantankerous grandfather, an avid naturalist, she figures out that the green grasshoppers are easier to see against the yellow grass, so they are eaten before they can get any larger.

As Callie explores the natural world around her, she develops a close relationship with her grandfather, navigates the dangers of living with six brothers, and comes up against just what it means to be a girl at the turn of the century.

Debut author Jacqueline Kelly deftly brings Callie and her family to life, capturing a year of growing up with unique sensitivity and a wry wit.",4/12/2025
2166088,9.78145E+12,,My books,,0,2/28/2025,3/4/2025,256,1,4,,,,0,,1,,,The House of Dies Drear,,en,Juvenile Fiction,Virginia Hamilton,,,,,,Open Road Media Teen  Tween,256,2/15/2011,ebook,,,,,,,,,,,,,,,,"In Virginia Hamilton’s Edgar Award–winning novel, teenager Thomas Small and his family must uncover the haunting historical legacy of their Civil War–era house

Shortly after moving into an old, spooky home, thirteen-year-old Thomas Small and his family start hearing strange noises. The house has a past, and when Thomas discovers a hidden passageway that may have been part of the Underground Railroad, the family realizes the house has a history as well. To find out all there is to know about the House of Dies Drear, Thomas must explore secret rooms—and the secrets of lives lived centuries before, lives that tell the story of America’s troubled early years.",4/5/2025
16522568,9.78134E+12,710L,My books,,0,3/3/2025,3/5/2025,0,1,5,,,,0,,1,,,Three Keys,,en,Asians,Kelly Yang,,,,,,,,1/1/2020,,,,,,,,,,,,,,,,,"""Mia Tang thinks she's going to have the best year ever. She and her parents are the proud owners of the Calivista Motel, she gets to run the front desk with her best friend, Lupe, and she's finally getting somewhere with her writing! But as it turns out, sixth grade is no picnic...""--Portion of back cover.",4/5/2025
2847752,9.78125E+12,780L,My books,,0,3/12/2025,3/15/2025,256,1,2.5,,,,0,,1,,,Lassie Come Home,,en,"Classics,Family,Animal Stories",Eric Knight,Marguerite Kirmse,,,,,Square Fish,256,10/13/2015,paperback,,,,,,,,,,,,,,,,"A beloved classic gets a beautiful new look.

Lassie is Joe's prize collie and constant companion. But when Joe's father loses his job, Lassie must be sold. Three times she escapes from her new owner, and three times she returns home to Joe, until finally she is taken to the remotest part of Scotland—too far a journey for any dog to make alone.

But Lassie is not just any dog.

First published in 1940, Lassie Come-Home has become one of the best-loved dog stories in the world. This beautiful edition showcases the original text and illustrations within a striking new jacket.",4/5/2025
15103890,9.78059E+12,,My books,,0,3/25/2025,4/5/2025,0,1,5,,,,0,,1,,,Redwall,,en,"Action & Adventure,Fantasy & Magic,Audiobooks",Brian Jacques,,,,Ariyon Bakare,,Listening Library,,12/6/2022,audiobook,,Redwall,1,,,,,,,,,,,,,"The book that inspired a legend—the first novel in the bestselling saga of Redwall. 

Welcome to Mossflower Wood, where the gentle mice have gathered to celebrate a year of peace and abundance. All is well…until a sinister shadow falls across the ancient stone abbey of Redwall. It is rumored that Cluny is coming—Cluny, the terrible one-eyed rat and his savage horde—Cluny, who has vowed to conquer Redwall Abbey! The only hope for the besieged mice lies in the lost sword of the legendary Martin the Warrior. And so begins the epic quest of a bumbling young apprentice—a courageous mouse who would rise up, fight back…and become a legend himself. 

“The medieval world of Redwall Abbey—where gallant mouse warriors triumph over evil invaders—has truly become the stuff of legend.”—Seattle Post-Intelligencer",4/5/2025
17247776,9.79889E+12,,My books,,0,3/24/2025,,0,1,,,,,0,,1,,,"The Wild Robot Protects (Wild Robot, 3)",,en,Juvenile Fiction,Peter Brown,,,,,,Youth Large Print,,1/10/2024,,,The Wild Robot,3,,,,,,,,,,,,,"Life for Roz and the animals on their island is wild, natural, harmonious. Her son Brightbill has even found a mate! But then, one day an injured seal washes ashore and warns of dangerous, cloudy waters that are flowing toward the island—and soon the animals are forced inland to fight over dwindling resources.

Roz calms and organizes the animals, but the poison tide takes a terrible toll on the island. And when the robot discovers that her new body is waterproof, she marches into the waves and sets out across the ocean, determined to stop the poison tide.

During her undersea journey, Roz encounters amazing geological formations and incredible creatures, and she sees the devastation caused by the toxic waters. Creatures she meets along the way direct her to a mysterious character known as the Ancient Shark, who explains that the poison tide is caused by a huge station that floats on the waves; a station operated by humans and by robots. To stop them, the Ancient Shark is prepared to attack with an army of sea creatures. However, Roz hopes to find a peaceful solution, instead. Can the wild robot save the ocean and her island and everything she loves?",3/24/2025
14615151,9.79877E+12,,My books,,0,1/8/2025,1/9/2025,304,1,5,,,,0,,1,,,The Rule of Three,,en,Juvenile Fiction,Heather Murphy Capps,,,,,,Carolrhoda Books (R),304,1/1/2024,hardcover,,,,,,,,,,,,,,,,"Wyatt has a three-part Plan for Life, and it starts now, at the beginning of seventh grade, with tryouts for his local travel baseball team. A biracial kid in a mostly white town, he’s always felt like a bit of an outsider. The baseball field is the only place where he feels like he truly belongs. If he can just make the team, everything else will fall into place: school, friends, even his relationship with his often-distant dad.

But after upsetting incidents at tryouts, something inexplicable happens: wisps of smoke form around Wyatt.

As Wyatt tries to figure out what’s causing this mysterious smoke and how to control it, he discovers it’s connected to a painful family history. The more he learns, the more Wyatt begins to question the rules he’s always followed to fit in. With tensions rising at school and on the field, can he face the injustices of the past while keeping his cool in the present?",3/23/2025
237234,9.78001E+12,,My books,,0,8/1/2024,8/5/2024,224,1,5,,,,0,,1,,,"The Magician's Nephew (Chronicles of Narnia, #6)",,en,Juvenile Fiction,C. S. Lewis,,,,,,HarperCollins UK,224,5/5/2009,,,,,,,,,,,,,,,,,"The secret passage to the house next door leads to a fascinating adventure

NARNIA...where the woods are thick and cold, where Talking Beasts are called to life...a new world where the adventure begins.

Digory and Polly meet and become friends one cold, wet summer in London. Their lives burst into adventure when Digory's Uncle Andrew, who thinks he is a magician, sends them hurtling to...somewhere else. They find their way to Narnia, newborn from the Lion's song, and encounter the evil sorceress Jadis before they finally return home.",3/23/2025
2053224,9.78155E+12,,My books,,0,3/6/2025,3/8/2025,208,1,2.5,,,,0,,1,,,"Ways to Grow Love (Ryan Hart, #2)",,en,"Fiction,Family,Society & Social Issues",Renée Watson,Nina Mata,,,,,Bloomsbury Children's Books,208,4/27/2021,hardcover,,Ryan Hart,2,,,,,,,,,,,,,"Newbery Honor and Coretta Scott King Author Award winner Renée Watson continues her charming young middle grade series starring Ryan Hart, a girl who is pure spirit and sunshine.

Ryan Hart and her family are back in another installment of stories about a Black girl finding her way and her voice as she grows through change and challenges. In this book, Ryan finds herself waiting on lots of things -- like for her new sister to be born healthy, for her new recipes to turn out right, for that summer camp trip to go better than she fears! And of course Ryan is facing these new challenges and new experiences in her classic style -- with a bright outlook and plenty of spirit!",3/23/2025
431424,9.78031E+12,,My books,,0,3/18/2025,3/20/2025,320,1,4.5,,,,0,,1,,,Harriet the Spy,,en,"Mystery & Detective,Classics,Picture Books",Louise Fitzhugh,,,,,,Yearling,320,7/1/2009,ebook,,,,,,,,,,,,,,,,"It's no secret that Harriet the Spy is a timeless classic that kids will love! Every day can be an adventure if you just look carefully enough! 

Harriet M. Welsch is a spy. In her notebook, she writes down everything she knows about everyone, even her classmates and her best friends. Then Harriet loses track of her notebook, and it ends up in the wrong hands. Before she can stop them, her friends have read the always truthful, sometimes awful things she’s written about each of them. Will Harriet find a way to put her life and her friendships back together?

""What the novel showed me as a child is that words have the power to hurt, but they can also heal, and that it’s much better in the long run to use this power for good than for evil.""—New York Times bestselling author Meg Cabot",3/20/2025
50274,9.78032E+12,720L,My books,,0,3/17/2025,3/17/2025,288,1,5,,,,0,,1,,,"The Wild Robot Escapes (The Wild Robot, #2)",,en,Juvenile Fiction,Peter Brown,,,,,,"Little, Brown Books for Young Readers",288,3/13/2018,ebook,,The Wild Robot,2,,,,,,,,,,,,,"Shipwrecked on a remote, wild island, Robot Roz learned from the unwelcoming animal inhabitants and adapted to her surroundings--but can she survive the challenges of the civilized world and find her way home to Brightbill and the island?",3/17/2025
31938,9.78032E+12,740L,My books,,0,3/15/2025,3/15/2025,279,1,5,,,,0,,1,,,"The Wild Robot (The Wild Robot, #1)",,en,"Fiction,General,Adventure",Peter Brown,,,,,,"Little, Brown Books for Young Readers",279,4/5/2016,hardcover,,The Wild Robot,1,,,,,,,,,,,,,"When robot Roz opens her eyes for the first time, she discovers that she is alone on a remote, wild island. Why is she there? Where did she come from? And, most important, how will she survive in her harsh surroundings? Roz's only hope is to learn from the island's hostile animal inhabitants. When she tries to care for an orphaned gosling, the other animals finally decide to help, and the island starts to feel like home. Until one day, the robot's mysterious past comes back to haunt her....",3/16/2025
576275,9.78159E+12,1020L,My books,,0,3/15/2025,3/15/2025,232,1,5,,,,0,,1,,,The Pushcart War,50th Anniversary Edition,en,"Middle Grade Books,20th Century,Picture Books",Jean Merrill,Ronni Solbert,,,,,NYR Children's Collection,232,9/16/2014,ebook,,,,,,,,,,,,,,,,"50th Anniversary Edition

Do you know the history of the pushcart war? The REAL history? it’s a story of how regular people banded together and, armed with little more than their brains and good aim defeated a mighty foe.

Not long ago the streets of New York City were smelly, smoggy, sooty, and loud. There were so many trucks making deliveries that it might take an hour for a car to travel a few blocks. People blamed the truck owners and the truck owners blamed the little wooden pushcarts that traveled the city selling everything from flowers to hot dogs. Behind closed doors the truck owners declared war on the pushcart peddlers. Carts were smashed from Chinatown to Chelsea. The peddlers didn’t have money or the mayor on their side, but that didn’t stop them from fighting back. They used pea shooters to blow tacks into the tires of trucks, they outwitted the police, and they marched right up to the grilles of those giant trucks and dared them to drive down their streets. Today, thanks to the ingenuity of the pushcart peddlers, the streets belong to the people—and to the pushcarts.

The Pushcart War was first published fifty years ago. It has inspired generations of children and been adapted for television, radio, and the stage around the world. It was included on School Library Journal’s list of “One Hundred Books That Shaped the Twentieth Century,” and its assertion that a committed group of men and women can prevail against a powerful force is as relevant in the twenty-...",3/15/2025
4442084,9.78153E+12,,My books,,0,,,352,1,,,,,0,,1,,,Spy School Project X,,en,"Children's Action & Adventure Books,Children's Humor,Children's Mystery, Detective, & Spy",Stuart Gibbs,,,,,,Simon & Schuster Books for Young Readers,352,9/6/2022,hardcover,,,,,,,,,,,,,,,,"In the tenth book in the New York Times bestselling Spy School series, Ben Ripley races against time and across state lines—by car, train, boat, and plane—to avoid his new cyber enemies and track down Murray Hill.

Ben Ripley’s longtime nemesis, Murray Hill, has put a price on Ben’s head and accused him of being at the center of a conspiracy on the internet. Now Ben finds himself in his greatest danger yet, on the run from both assassins and conspiracy theorists. 

Ben must find Murray before his machinations catch up to Ben—but with so much at stake, even some of Ben’s most trusted friends might not be at the top of their game, leaving Ben to be tested like never before.",3/4/2025
72,9.78153E+12,850L,My books,,0,,,320,1,,,,,0,,1,,,Spy School British Invasion (Spy School #7),,en,"Fiction,General,Adventure",Stuart Gibbs,,,,,,Simon  Schuster Books for Young Readers,320,4/30/2019,hardcover,,Spy School,7,,,,,,,,,,,,,"Superspy middle schooler Ben Ripley is finally going to take SPYDER down, once and for all in this latest addition to the New York Times bestselling Spy School series.

Stranded in Mexico after nearly capturing the leaders of SPYDER, thirteen-year-old Ben Ripley desperately needs to take a shower. But even more so, he and his spy school friends need to come up with a new plan to defeat their enemies, their only clue a key that opens…something. 

The Mission: Go rogue from the CIA, join up with the British MI6 to locate the leader of SPYDER, the enigmatic Mr. E, and bring down the evil organization once and for all.

Only it won’t be easy. They’ll have to deal with rival evil splinter factions, devious double-crosses and learning to drive on the opposite side of the road. But they have no other choice: this is their last and final chance to crack the code on SPYDER.",3/4/2025
