Book Id,ISBN,Lexile Score,Bookshelf,Tags,Wishlist,Started Reading On,Ended Reading On,Pages Read,Read,My Rating,Review,Short note,Advanced note,Signed,Condition,Number of copies,Quotes,Flashcards,Title,Subtitle,Language,Categories,Authors,Illustrators,Translators,Editors,Narrators,Photographers,Publisher,Page Count,Published At,Format,Edition,Series,Volume,Loan Type,Loan Name,Loan Start Date,Loan Due Date,Purchase Type,Purchase From,Purchase Price,Purchase Date,Transfer Type,Transfer place,Transfer Price,Transfer Date,Description,Date added
2943800,9.78153E+12,860L,My books,,0,,,352,1,,,,,0,,1,,,Spy School at Sea,,en,"Adventure,Crime,Humour",Stuart Gibbs,,,,,,Simon  Schuster Books for Young Readers,352,8/31/2021,hardcover,,Spy School,9,,,,,,,,,,,,,"In the ninth and latest addition to the New York Times bestselling Spy School series, Ben Ripley faces his nemesis, Murray Hill, on the high seas.

Thanks to the evidence Ben uncovered in his investigation of the Croatoan, the CIA has tracked his nemesis, Murray Hill, to Central America, where they believe he is boarding the world’s biggest cruise ship, The Emperor of the Seas, on its maiden voyage around the world.

His mission: Pose as part of a family, with Alexander and Catherine Hale as his parents, Erica as his sister, and his best friend Mike as his brother, to find out what Murray is plotting. 

At first, it sounds exciting to have a mission on the most glamorous ocean liner on earth, but as usual, nothing goes according to plan. There is action, danger, and plenty of surprises as Ben and his team quickly find themselves in hot water.",3/4/2025
12714067,9.78167E+12,,My books,,0,,,352,1,,,,,0,,1,,,Spy School Goes Wild,,en,"Children's Action & Adventure Books,Children's Humor,Children's Mystery, Detective, & Spy",Stuart Gibbs,,,,,,Simon & Schuster Books for Young Readers,352,9/24/2024,hardcover,,Spy School,12,,,,,,,,,,,,,"In the twelfth book in Stuart Gibbs’s New York Times bestselling Spy School series, superspy middle schooler Ben Ripley gets lost on a perilous mission with one of his greatest enemies. Ben Ripley is recruited for a top secret mission to bring down his nemesis, Murray Hill, once and for all. But when things go horribly wrong, Ben ends up lost in an extremely dangerous wilderness with Murray—and confronting a new, devious enemy—with none of his friends to help him. Now, Ben must figure out how to survive and deduce what evil plan his new enemy is plotting in time to thwart it.",3/4/2025
8547732,9.78167E+12,,My books,,0,,,304,1,,,,,0,,1,,,Spy School Goes North,,en,"Children's Action & Adventure Books,Children's Humor,Children's Mystery, Detective, & Spy",Stuart Gibbs,,,,,,Simon & Schuster Books for Young Readers,304,10/3/2023,hardcover,,Spy School,11,,,,,,,,,,,,,"In the eleventh book in the New York Times bestselling Spy School series, Ben Ripley goes on a rescue mission when one of his own is abducted from a remote Alaskan training facility.

Ben Ripley and his friends are training in Alaska when Cyrus Hale is kidnapped by his old Russian nemesis. Ben, Erica, and the others mount a rescue mission, but events quickly spiral out of control in a plot involving the secret history of US-Russian relations, a young KGB agent with skills to rival Erica’s—and lots and lots of bears.",3/4/2025
1275833,9.78148E+12,780L,My books,,0,,,352,1,,,,,0,,1,,,Spy School Goes South,,en,"Adventure,Crime,Humour",Stuart Gibbs,,,,,,Simon  Schuster Books for Young Readers,352,10/2/2018,hardcover,,Spy School,6,,,,,,,,,,,,,"Ben is taken to Mexico by his nemesis in the hopes that he’ll finally be able to take down SPYDER in this latest addition to the New York Times bestselling Spy School series.

Thirteen-year-old Ben Ripley has been caught in the snares of SPYDER more than once and knows well enough to be suspicious of anything that seems too good to be true—despite needing special tutoring in advanced survival techniques. So when Murray Hill finally breaks his silence with an offer to hand over the SPYDER elite, Ben knows that there must be something going on. But his hesitation doesn’t stop the assignment.

The Mission: Follow Murray Hill to an undisclosed location with no one else but Erica Hale to identify SPYDER leadership. Once found, contact the CIA to sweep in and finish the job. DO NOT CONTACT SPYDER DIRECTLY.

However, as Ben suspected, nothing goes as planned, and what should be an easy mission quickly turns deadly. Now, Ben and Erica will have to face rogue agents, trained killers, and even very hungry crocodiles in a race against the clock to find out what SPYDER is up to this time—and thwart their evil plans.",3/4/2025
63266,9.78144E+12,740L,My books,,0,,,320,1,,,,,0,,1,,,Spy School,,en,"Adventure,Crime,Humour",Stuart Gibbs,,,,,,Simon  Schuster Books for Young Readers,320,4/2/2013,paperback,,Spy School,1,,,,,,,,,,,,,"Can an undercover nerd become a superstar agent? Ben Ripley sure hopes so—and his life may depend on it!

Ben Ripley may only be in middle school, but he’s already pegged his dream job: C.I.A. or bust. Unfortunately for him, his personality doesn’t exactly scream “secret agent.” In fact, Ben is so awkward, he can barely get to school and back without a mishap. Because of his innate nerdiness, Ben is not surprised when he is recruited for a magnet school with a focus on science—but he’s entirely shocked to discover that the school is actually a front for a junior C.I.A. academy. Could the C.I.A. really want him?

Actually, no. There’s been a case of mistaken identity—but that doesn’t stop Ben from trying to morph into a supercool undercover agent, the kind that always gets the girl. And through a series of hilarious misadventures, Ben realizes he might actually be a halfway decent spy…if he can survive all the attempts being made on his life!",3/4/2025
715720,9.78148E+12,730L,My books,,0,,,384,1,,,,,0,,1,,,Spy Ski School,,en,Crime,Stuart Gibbs,,,,,,Simon  Schuster Books for Young Readers,384,10/10/2017,paperback,,Spy School,4,,,,,,,,,,,,,"Ben Ripley enrolls in ski school, where the slopes, and the stakes, get really steep in this follow-up to the Edgar Award nominated ""Spy School,"" ""Spy Camp,"" and ""Evil Spy School."" 
Twelve-year-old Ben Ripley is not exactly the best student spy school has ever seen he keeps flunking Advanced Self Preservation. But outside of class, Ben is pretty great at staying alive. His enemies have kidnapped him, shot at him, locked him in a room with a ticking time bomb, and even tried to blow him up with ""missiles."" And he s survived every time. 
After all that unexpected success, the CIA has decided to activate Ben for real. 
The Mission: Become friends with Jessica Shang, the daughter of a suspected Chinese crime boss, and find out all of her father s secrets. Jessica wants to go to ski school in the Rocky Mountains, so a select few spy school students are going skiing too under cover, of course. 
Ben might not be able to handle a weapon (or a pair of skis), but he can make friends easy peasy. That is, until his best friend from home drops in on the trip and jeopardizes the entire mission """,3/4/2025
980659,9.78153E+12,820L,My books,,0,,,352,1,,,,,0,,1,,,Spy School Revolution,,en,"Adventure,Crime,Humour",Stuart Gibbs,,,,,,Simon  Schuster Books for Young Readers,352,10/6/2020,hardcover,,Spy School,8,,,,,,,,,,,,,"Superspy middle schooler Ben Ripley faces the Croatoan—a new evil organization that’s so mysterious, the only proof it exists is from the American Revolution—in this latest addition to the New York Times bestselling Spy School series.

With SPYDER defeated, Ben Ripley is looking forward to his life getting back to normal, or as normal as possible when you’re a superspy in training. For once, everything seems to be right in Ben’s world...until someone bombs the CIA conference room next door.

To Ben’s astonishment, the attacker is none other than Erica Hale, the spy-in-training he respects more than any other. Ben refuses to believe Erica is working for the enemy...even if the rest of the CIA does.

His mission: prove Erica is not a double agent working against the US, locate the fabled colonial-era insurgent group that’s blackmailing her, figure out what their devious plot is, and thwart it.

But this time, Ben finds himself up against opponents he has never encountered before: his own friends. They’re not as ready to trust in Erica as he is, and Ben is forced to rely on his own wits and skills more than ever before. How can he succeed when he doesn’t even know who he can trust?",3/4/2025
1439906,9.78148E+12,HL820L,My books,,0,,,352,1,,,,,0,,1,,,"Spy School Secret Service (Spy School, #5)",,en,Juvenile Fiction,Stuart Gibbs,,,,,,Simon  Schuster Books for Young Readers,352,10/10/2017,hardcover,,,,,,,,,,,,,,,,"Ben goes undercover in the White House to take on a SPYDER operative determined to assassinate the president in this latest addition to the New York Times bestselling Spy School series.

Thirteen-year-old Ben Ripley has had a lot of field success despite only just beginning his second year at Spy School, something graduates rarely experience. But he’d never have survived without the help from experienced agents and his friends.

Now he’s been called in on a solo mission—and the fate of the United States of America is on his shoulders alone.

The Mission: Prevent a presidential assassination by infiltrating the White House, and locating the enemy operative. But when the president’s son is as helpful as a hamster, and a trained SPYDER agent would never appear to be up to something (they’re far too clever for that), Ben may be in over his head this time.

And when everything goes wrong, Ben must rely on his Spy School friends to save his reputation…but even friends can double-cross or be swayed to the enemy’s side.",3/4/2025
16999499,9.78146E+12,"
1050L",My books,,0,2/12/2025,2/12/2025,104,1,4,,,,0,,1,,,How to Become an Accidental Entrepreneur,,en,,"Elizabeth MacLeod,Frieda Wishinsky",Jenn Playford,,,,,Orca,104,9/13/2022,hardcover,,,,,,,,,,,,,,,,"How do entrepreneurs get ideas for a new business and how do they make their businesses thrive? What drives some entrepreneurs to use their ability and wealth to help others pursue their dreams and live better lives? Every entrepreneur has a unique story, but many share qualities that have helped them on their road to achievement.

In How to Become an Accidental Entrepreneur readers will meet almost 100 entrepreneurs, such as Stephen Spielberg, Victoria Kisyombe, Oprah Winfrey and Amit Goffer, whose work has made a difference around the world. These entrepreneurs and more used their financial prosperity to help the world by giving donations or setting up charitable organizations. Young readers will discover the fascinating stories of people who turned obstacles into creative actions that allowed them to start new companies and create jobs for others.",3/4/2025
